{
  "schemaVersion": 1,
  "kind": "omarchy-plugin-check/store-details",
  "version": 1790975389,
  "docs": {
    "akitaonrails.ai-usagebar": "cb894e8bea77a0e260a4b26f983ec9206b38d5ee3ae093c13aecf733d82a4caa",
    "io.github.letsfg.flights": "9f4ef3035591b79963e295315186dfa03ace9477f71ec88a32e7d76759ed9d24",
    "omamail": "701b723cd1353e90ae066d998d0829ea142794a9e44a411fdc5a602debec8504"
  }
}
